
T:  Bus=01 Lev=00 Prnt=00 Port=00 Cnt=00 Dev#=  1 Spd=480  MxCh=16
D:  Ver= 2.00 Cls=09(hub  ) Sub=00 Prot=01 MxPS=64 #Cfgs=  1
P:  Vendor=1d6b ProdID=0002 Rev=06.08
S:  Manufacturer=Linux 6.8.0-85-generic xhci-hcd
S:  Product=xHCI Host Controller
S:  SerialNumber=0000:00:14.0
C:  #Ifs= 1 Cfg#= 1 Atr=e0 MxPwr=0mA
I:  If#= 0 Alt= 0 #EPs= 1 Cls=09(hub  ) Sub=00 Prot=00 Driver=hub
E:  Ad=81(I) Atr=03(Int.) MxPS=   4 Ivl=256ms

T:  Bus=01 Lev=01 Prnt=01 Port=00 Cnt=01 Dev#=  2 Spd=12   MxCh= 0
D:  Ver= 1.10 Cls=00(>ifc ) Sub=00 Prot=00 MxPS=64 #Cfgs=  1
P:  Vendor=25a7 ProdID=fa67 Rev=07.21
S:  Manufacturer=CX
S:  Product=2.4G Receiver
C:  #Ifs= 2 Cfg#= 1 Atr=a0 MxPwr=100mA
I:  If#= 0 Alt= 0 #EPs= 1 Cls=03(HID  ) Sub=01 Prot=01 Driver=usbhid
E:  Ad=81(I) Atr=03(Int.) MxPS=   8 Ivl=10ms
I:  If#= 1 Alt= 0 #EPs= 1 Cls=03(HID  ) Sub=01 Prot=02 Driver=usbhid
E:  Ad=82(I) Atr=03(Int.) MxPS=   8 Ivl=2ms

T:  Bus=01 Lev=01 Prnt=02 Port=01 Cnt=01 Dev#=  3 Spd=12   MxCh= 0
D:  Ver= 2.00 Cls=00(>ifc ) Sub=00 Prot=00 MxPS=32 #Cfgs=  1
P:  Vendor=046d ProdID=c52b Rev=24.11
S:  Manufacturer=Logitech
S:  Product=USB Receiver
C:  #Ifs= 3 Cfg#= 1 Atr=a0 MxPwr=98mA
I:  If#= 0 Alt= 0 #EPs= 1 Cls=03(HID  ) Sub=01 Prot=01 Driver=usbhid
E:  Ad=81(I) Atr=03(Int.) MxPS=   8 Ivl=8ms
I:  If#= 1 Alt= 0 #EPs= 1 Cls=03(HID  ) Sub=01 Prot=02 Driver=usbhid
E:  Ad=82(I) Atr=03(Int.) MxPS=   8 Ivl=2ms
I:  If#= 2 Alt= 0 #EPs= 1 Cls=03(HID  ) Sub=00 Prot=00 Driver=usbhid
E:  Ad=83(I) Atr=03(Int.) MxPS=  32 Ivl=2ms

T:  Bus=01 Lev=01 Prnt=03 Port=03 Cnt=01 Dev#=  4 Spd=12   MxCh= 0
D:  Ver= 1.10 Cls=00(>ifc ) Sub=00 Prot=00 MxPS= 8 #Cfgs=  1
P:  Vendor=26ce ProdID=01a2 Rev=00.00
S:  Manufacturer=ASRock
S:  Product=LED Controller
S:  SerialNumber=A02019100900
C:  #Ifs= 0 Cfg#= 0 Atr= MxPwr=
I:  If#= 2 Alt= 0 #EPs= 1 Cls=03(HID  ) Sub=00 Prot=00 Driver=(none)

T:  Bus=01 Lev=01 Prnt=04 Port=04 Cnt=01 Dev#=  8 Spd=480  MxCh= 0
D:  Ver= 2.00 Cls=ff(vend.) Sub=ff Prot=ff MxPS=64 #Cfgs=  1
P:  Vendor=083a ProdID=4505 Rev=48.10
S:  Manufacturer=SMC
S:  Product=USB2.0 WLAN
C:  #Ifs= 1 Cfg#= 1 Atr=80 MxPwr=500mA
I:  If#= 0 Alt= 0 #EPs= 4 Cls=ff(vend.) Sub=00 Prot=00 Driver=zd1211rw
E:  Ad=01(O) Atr=02(Bulk) MxPS= 512 Ivl=0ms
E:  Ad=04(O) Atr=03(Int.) MxPS=  64 Ivl=125us
E:  Ad=82(I) Atr=02(Bulk) MxPS= 512 Ivl=0ms
E:  Ad=83(I) Atr=03(Int.) MxPS=  64 Ivl=125us

T:  Bus=01 Lev=01 Prnt=08 Port=06 Cnt=01 Dev#=  5 Spd=480  MxCh= 3
D:  Ver= 2.00 Cls=09(hub  ) Sub=00 Prot=02 MxPS=64 #Cfgs=  1
P:  Vendor=05e3 ProdID=0610 Rev=61.60
S:  Product=USB2.0 Hub
C:  #Ifs= 1 Cfg#= 1 Atr=e0 MxPwr=100mA
I:  If#= 0 Alt= 1 #EPs= 1 Cls=09(hub  ) Sub=00 Prot=02 Driver=hub
E:  Ad=81(I) Atr=03(Int.) MxPS=   1 Ivl=256ms

T:  Bus=01 Lev=01 Prnt=05 Port=08 Cnt=01 Dev#=  6 Spd=1.5  MxCh= 0
D:  Ver= 1.10 Cls=00(>ifc ) Sub=00 Prot=00 MxPS= 8 #Cfgs=  1
P:  Vendor=413c ProdID=2113 Rev=01.08
S:  Product=Dell KB216 Wired Keyboard
C:  #Ifs= 2 Cfg#= 1 Atr=a0 MxPwr=100mA
I:  If#= 0 Alt= 0 #EPs= 1 Cls=03(HID  ) Sub=01 Prot=01 Driver=usbhid
E:  Ad=81(I) Atr=03(Int.) MxPS=   8 Ivl=24ms
I:  If#= 1 Alt= 0 #EPs= 1 Cls=03(HID  ) Sub=00 Prot=00 Driver=usbhid
E:  Ad=82(I) Atr=03(Int.) MxPS=   8 Ivl=48ms

T:  Bus=02 Lev=00 Prnt=00 Port=00 Cnt=00 Dev#=  1 Spd=20000 MxCh=10
D:  Ver= 3.10 Cls=09(hub  ) Sub=00 Prot=03 MxPS= 9 #Cfgs=  1
P:  Vendor=1d6b ProdID=0003 Rev=06.08
S:  Manufacturer=Linux 6.8.0-85-generic xhci-hcd
S:  Product=xHCI Host Controller
S:  SerialNumber=0000:00:14.0
C:  #Ifs= 1 Cfg#= 1 Atr=e0 MxPwr=0mA
I:  If#= 0 Alt= 0 #EPs= 1 Cls=09(hub  ) Sub=00 Prot=00 Driver=hub
E:  Ad=81(I) Atr=03(Int.) MxPS=   4 Ivl=256ms
